{
  "id": "twofa-helper",
  "name": "两步验证助手",
  "version": "1.2.7",
  "api_version": "1",
  "app_version": ">=0.1.0",
  "author": "PTPatronus Community",
  "description": "基于 Base32 密钥生成 TOTP 验证码（迁移自 MoviePilot）。",
  "license": "MIT",
  "keywords": [
    "2fa",
    "totp",
    "otp"
  ],
  "runtime": "external-http",
  "entry": {
    "command": "python",
    "args": [
      "plugin.py"
    ],
    "health": "/health"
  },
  "permissions": [
    "log:write"
  ],
  "events": [],
  "actions": [
    {
      "name": "generate",
      "label": "生成验证码",
      "description": "为配置/输入的 secret 生成当前 TOTP。"
    },
    {
      "name": "list",
      "label": "列出账户",
      "description": "列出已配置账户（不含 secret）。"
    }
  ],
  "config_schema": [
    {
      "key": "accounts",
      "label": "账户列表",
      "type": "textarea",
      "default": "",
      "help": "每行 name|BASE32_SECRET 或 otpauth uri"
    }
  ]
}
